{
  "$schema": "https://json-schema.org/draft/2020-12/schema",
  "$id": "https://cohere.com/attestation-policy-ledger/v1",
  "title": "Cohere Model Attestation Predicate",
  "description": "Custom in-toto predicate for the Cohere confidential computing model attestation ledger. Each predicate represents one model's attestation state at a point in time, forming a verifiable chain via previous_rekor_log_index.",
  "type": "object",
  "required": [
    "model_path",
    "event_type",
    "timestamp",
    "release_version",
    "measurements",
    "policy_id",
    "rego_policy_hash",
    "initdata_hash",
    "previous_rekor_log_index",
    "tool_versions",
    "source_artifacts"
  ],
  "additionalProperties": false,
  "properties": {
    "model_path": {
      "type": "string",
      "description": "Model identifier matching the folder name under models/ (e.g. 'command-r-plus').",
      "pattern": "^[a-z0-9][a-z0-9-]*$",
      "examples": ["command-r-plus", "aya-expanse"]
    },
    "event_type": {
      "type": "string",
      "enum": ["policy_activated", "policy_deprecated", "policy_revoked"],
      "description": "What happened in this ledger entry. policy_activated: a new policy was created from fresh measurements. policy_deprecated: routine retirement. policy_revoked: emergency removal due to security incident."
    },
    "event_reason": {
      "type": "string",
      "description": "Optional human-readable explanation for this event.",
      "default": ""
    },
    "timestamp": {
      "type": "string",
      "format": "date-time",
      "description": "ISO 8601 UTC timestamp of when this predicate was generated."
    },
    "release_version": {
      "type": "string",
      "description": "The version tag of the GitHub release containing this attestation (e.g. 'v0.0.1').",
      "pattern": "^v\\d+\\.\\d+\\.\\d+",
      "examples": ["v0.0.1", "v1.2.3"]
    },
    "measurements": {
      "type": "object",
      "description": "TDX measurement register values computed by cvm-measure. Each value is a 96-character hex string (48 bytes / 384 bits).",
      "required": ["mrtd", "rtmr0", "rtmr1", "rtmr2", "rtmr3"],
      "additionalProperties": false,
      "properties": {
        "mrtd": {
          "type": "string",
          "pattern": "^[a-f0-9]{96}$",
          "description": "Measurement of the TD (MRTD) -- covers firmware, kernel, and initial TD configuration."
        },
        "rtmr0": {
          "type": "string",
          "pattern": "^[a-f0-9]{96}$",
          "description": "Runtime Measurement Register 0 -- BIOS/firmware events."
        },
        "rtmr1": {
          "type": "string",
          "pattern": "^[a-f0-9]{96}$",
          "description": "Runtime Measurement Register 1 -- OS/kernel events."
        },
        "rtmr2": {
          "type": "string",
          "pattern": "^[a-f0-9]{96}$",
          "description": "Runtime Measurement Register 2 -- application-level events."
        },
        "rtmr3": {
          "type": "string",
          "pattern": "^[a-f0-9]{96}$",
          "description": "Runtime Measurement Register 3 -- derived from initdata (Kata agent policy hash)."
        }
      }
    },
    "policy_id": {
      "type": "string",
      "format": "uuid",
      "description": "The ITA attestation policy UUID. This single policy ID covers all models in the release."
    },
    "rego_policy_hash": {
      "type": "string",
      "pattern": "^[a-f0-9]{64}$",
      "description": "SHA-256 hash of the full Kata agent Rego policy text. The full policy is available as a release artifact."
    },
    "initdata_hash": {
      "type": "string",
      "pattern": "^[a-f0-9]{64}$",
      "description": "SHA-256 hash of the base64-encoded initdata blob that genpolicy produced."
    },
    "previous_rekor_log_index": {
      "type": "integer",
      "minimum": 0,
      "description": "Rekor transparency log index of this model's previous attestation entry. 0 for the genesis entry (first ever attestation for this model). Forms a per-model linked list in Rekor."
    },
    "tool_versions": {
      "type": "object",
      "description": "Versions of the tools used to produce this attestation. Enables reproducibility.",
      "required": ["genpolicy", "cvm_measure"],
      "additionalProperties": true,
      "properties": {
        "genpolicy": {
          "type": "string",
          "description": "Version of the Kata genpolicy binary (from Kata release tag).",
          "examples": ["3.12.0"]
        },
        "cvm_measure": {
          "type": "string",
          "description": "Version of the cvm-measure tool (pip show cvm-measure).",
          "examples": ["0.3.0"]
        }
      }
    },
    "source_artifacts": {
      "type": "object",
      "description": "References to the input artifacts used to compute measurements. Enables auditors to reproduce the computation.",
      "required": ["firmware_ref", "uki_ref", "baseline_ref"],
      "additionalProperties": true,
      "properties": {
        "firmware_ref": {
          "type": "string",
          "description": "Reference to the OVMF firmware used (URL, SHA, or GCP image name)."
        },
        "uki_ref": {
          "type": "string",
          "description": "Reference to the Unified Kernel Image (BOOTX64.EFI) used."
        },
        "baseline_ref": {
          "type": "string",
          "description": "Reference to the baseline JSON (e.g. cohere-cc-baselines commit SHA or URL)."
        }
      }
    }
  }
}
