{
  "model_path": "command-r-plus",
  "event_type": "policy_activated",
  "event_reason": "Initial attestation for command-r-plus v0.1.0 deployment",
  "timestamp": "2026-05-01T12:00:00+00:00",
  "release_version": "v0.0.1",
  "measurements": {
    "mrtd": "8370d8f6d02f2d13e211e91c93fde923049522b241425a29a7bf0071ef49b250af4ef49d852fa3e10065d1b51dfce8fb",
    "rtmr0": "65f60f9929a36b146f69063f6b2d67dff42ea3cda500cb637cf655c29427c4710cca4e8abd7f32a7f1c2622f27cbb4d2",
    "rtmr1": "c35bbfad7ba5d703b2f78e0741e69a18a6f6093319af8440c8e3384b684e39947769dff3ba268c25d632f7459452e239",
    "rtmr2": "e03c2e6378a0d0b66ced6612e58dbc5bea8b8a7183055e5674602bd7b2da79a69dc1148fd9646ba03b71672473670d90",
    "rtmr3": "a1b2c3d4e5f60718293a4b5c6d7e8f901a2b3c4d5e6f0718293a4b5c6d7e8f901a2b3c4d5e6f0718293a4b5c6d7e8f90"
  },
  "policy_id": "e34efa4e-9dde-4c6b-994f-0e95d3bce4ce",
  "rego_policy_hash": "a1b2c3d4e5f6071829304050607080901a2b3c4d5e6f07182930405060708090",
  "initdata_hash": "b2c3d4e5f607182930405060708090a1b2c3d4e5f607182930405060708090a1",
  "previous_rekor_log_index": 0,
  "tool_versions": {
    "genpolicy": "3.12.0",
    "cvm_measure": "0.3.0"
  },
  "source_artifacts": {
    "firmware_ref": "projects/gce-tcb-integrity/global/images/ovmf-2024-08",
    "uki_ref": "sha384:abc123def456...",
    "baseline_ref": "https://github.com/cohere-ai/cohere-cc-baselines/commit/abc123"
  }
}
